{
  "report_id": "xray_PA01",
  "modality": "xray",
  "file_name": "PA01.pdf",
  "patient_metadata": {
    "name": "PA01",
    "age": null,
    "sex": null,
    "date": null
  },
  "facts": [
    {
      "fact_id": "xr1_f01",
      "source_text": "Positional rotation.",
      "concept": "positional rotation",
      "assertion": "PRESENT",
      "value": null,
      "unit": null,
      "reference_range": null,
      "section": "Chest PA"
    },
    {
      "fact_id": "xr1_f02",
      "source_text": "Lung feilds are clear.",
      "concept": "lung fields clarity",
      "assertion": "NORMAL",
      "value": null,
      "unit": null,
      "reference_range": null,
      "section": "Chest PA"
    },
    {
      "fact_id": "xr1_f03",
      "source_text": "Hila appear normal",
      "concept": "pulmonary hila morphology",
      "assertion": "NORMAL",
      "value": null,
      "unit": null,
      "reference_range": null,
      "section": "Chest PA"
    },
    {
      "fact_id": "xr1_f04",
      "source_text": "Mediastinum is central , trachea is in midline",
      "concept": "mediastinal and tracheal alignment",
      "assertion": "NORMAL",
      "value": null,
      "unit": null,
      "reference_range": null,
      "section": "Chest PA"
    },
    {
      "fact_id": "xr1_f05",
      "source_text": "Cardio-thoracic ratio is within normal limits",
      "concept": "cardiothoracic ratio",
      "assertion": "NORMAL",
      "value": null,
      "unit": null,
      "reference_range": null,
      "section": "Chest PA"
    },
    {
      "fact_id": "xr1_f06",
      "source_text": "Both domes of diaphragm appear normal",
      "concept": "diaphragmatic contours",
      "assertion": "NORMAL",
      "value": null,
      "unit": null,
      "reference_range": null,
      "section": "Chest PA"
    },
    {
      "fact_id": "xr1_f07",
      "source_text": "CP angles appear clear",
      "concept": "costophrenic angles",
      "assertion": "NORMAL",
      "value": null,
      "unit": null,
      "reference_range": null,
      "section": "Chest PA"
    },
    {
      "fact_id": "xr1_f08",
      "source_text": "Bony thorax appears intact",
      "concept": "bony thorax integrity",
      "assertion": "NORMAL",
      "value": null,
      "unit": null,
      "reference_range": null,
      "section": "Chest PA"
    }
  ]
}