{
  "report_id": "xray_PA03",
  "modality": "xray",
  "file_name": "PA03.pdf",
  "patient_metadata": {
    "name": "PA03",
    "age": null,
    "sex": null,
    "date": null
  },
  "facts": [
    {
      "fact_id": "xr3_f01",
      "source_text": "Loss of lumbar lordosis.",
      "concept": "loss of lumbar lordosis",
      "assertion": "PRESENT",
      "value": null,
      "unit": null,
      "reference_range": null,
      "section": "SPINE"
    },
    {
      "fact_id": "xr3_f02",
      "source_text": "Multi-level osteophytic changes.",
      "concept": "osteophytes",
      "assertion": "PRESENT",
      "value": null,
      "unit": null,
      "reference_range": null,
      "section": "SPINE"
    },
    {
      "fact_id": "xr3_f03",
      "source_text": "No abnormal paravertebral soft tissue shadow is seen.",
      "concept": "paravertebral soft tissue shadow",
      "assertion": "ABSENT",
      "value": null,
      "unit": null,
      "reference_range": null,
      "section": "SPINE"
    },
    {
      "fact_id": "xr3_f04",
      "source_text": "IVD Spaces are normal",
      "concept": "intervertebral disc space",
      "assertion": "NORMAL",
      "value": null,
      "unit": null,
      "reference_range": null,
      "section": "SPINE"
    }
  ]
}